job_title,company_name,location,job_type,experience_level,education_req,salary_range,job_requirements,job_responsibilities,posted_date,source_platform
IT & Business System Staff,PT Adam Dani Lestari,Medan,Full time,Fresh graduate dengan portfolio/project yang baik dipersilakan melamar Pen,Tidak tersedia,Tidak tersedia,"PT Adam Dani Lestari sedang mencari IT & Business System Staff untuk membantu mengembangkan, memelihara, dan meningkatkan sistem digital internal perusahaan, termasuk sistem operasional, pelaporan, automasi, dan pengelolaan data. Posisi ini cocok untuk kandidat yang memiliki kemampuan teknis, nyaman menggunakan tools AI untuk membantu pekerjaan IT, serta bersedia memahami proses bisnis secara nyata. Tanggung Jawab : Mengembangkan dan memelihara aplikasi bisnis internal berbasis web Mendukung pengembangan database, laporan, dan dashboard Membantu automasi proses bisnis dan alur data Memelihara serta meningkatkan sistem operasional internal Memberikan dukungan kepada user dari berbagai departemen Melakukan testing, troubleshooting, dan dokumentasi perubahan sistem Menggunakan tools AI secara bertanggung jawab untuk mempercepat pengembangan dan pemecahan masalah Kualifikasi : Pendidikan minimal D3/S1 di bidang IT, Ilmu Komputer, Sistem Informasi, atau bidang terkait Fresh graduate dengan portfolio/project yang baik dipersilakan melamar Pengalaman 1–3 tahun lebih diutamakan Memiliki pemahaman dasar pengembangan aplikasi web Memahami konsep database Mampu bekerja dengan laporan, Excel, atau data bisnis Nyaman menggunakan tools AI seperti ChatGPT, Cursor, Codex, Claude Code, GitHub Copilot, atau tools sejenis Mampu berkomunikasi dengan user non-teknis Keahlian yang Diutamakan : JavaScript / TypeScript Node.js React / Next.js PostgreSQL atau database SQL lainnya Power BI Git / GitHub Dasar Docker Integrasi API Microsoft 365, SharePoint, atau Power Automate Pengetahuan mobile app development menjadi nilai tambah Karakter yang Dicari : Kami mencari kandidat yang : Jujur dan bertanggung jawab Teliti dan detail-oriented Bersedia mempelajari proses bisnis perusahaan Praktis dan berorientasi pada solusi Mampu mengikuti instruksi dan scope project Teliti dalam melakukan testing sebelum implementasi Nyaman bekerja dengan tools AI, tetapi tidak bergantung secara buta Ruang Lingkup ",Tidak tersedia,13 jam yang lalu,JobStreet
Data Quality,PT Reasuransi Maipark Indonesia,Jakarta Raya,Kontrak/Temporer,fresh graduate); Memiliki pengetahuan dasar- dasar Asuransi; Mampu menggun,Tidak tersedia,Tidak tersedia,"Deskripsi Pekerjaan: Melakukan proses pemeriksaan atas data compulsory cession (misalnya pemeriksaan alamat risiko, interest insured , dll); Membuat analisis pada data compulsory cession; Melakukan pemeriksaan atas akurasi dan kesesuaian data dengan SOP yang berlaku; Menyusun laporan secara lengkap, akurat, dan sesuai waktu yang ditentukan Kualifikasi: Strata 1 (S1), Jurusan Manajemen Asuransi/ Ekonomi/ Accounting; Pengalaman kerja min. 1 tahun (terbuka untuk fresh graduate); Memiliki pengetahuan dasar- dasar Asuransi; Mampu menggunakan Microsoft Office; Memiliki kemampuan Bahasa Inggris (tingkat dasar); Mampu bekerja dengan disiplin dan penuh ketelitian.",Tidak tersedia,14 jam yang lalu,JobStreet
HCIS and Data Analytics Supervisor,PT Amerta Indah Otsuka,Jakarta Raya,Full time,Tidak tersedia,Tidak tersedia,Tidak tersedia,"Bachelor's degree in Data Science, Statistics, Human Resources, Information Systems, or a related field
Minimum 3 years of experience in human capital data analytics or digital HR systems
Proficient in analytics platforms (Power BI, Tableau, Excel)
Knowledge of HCIS platforms and data integration
Certification in HR and Data Analyst would be a plus","HC Data Strategy, Analytics & Insights | Analyze HC data to support strategic decision-making.
Create and automate HC dashboards and reporting.
Manage employee survey data to generate insights and evaluations.
Support talent mapping and workforce planning through data analysis. | HRIS & Digitalization | Identify and develop automation processes to improve work efficiency.
Collaborate with IT teams and vendors in HCIS development.
Integrate HCIS with other systems such as payroll and ERP.
Evaluate and improve HC data management tools and processes.
Provide user training and system support.
Support HC digital transformation and system governance initiatives. | Data Management & Governance | Manage and ensure the accuracy of employee data in HCIS.
Support performance, payroll, and talent management data processes.
Compile and validate performance appraisal data.
Perform regular data cleansing and reconciliation.
Ensure data security and compliance with company policies. | Job Requirements | Bachelor's degree in Data Science, Statistics, Human Resources, Information Systems, or a related field
Minimum 3 years of experience in human capital data analytics or digital HR systems
Proficient in analytics platforms (Power BI, Tableau, Excel)
Knowledge of HCIS platforms and data integration
Certification in HR and Data Analyst would be a plus",14 jam yang lalu,JobStreet
IT Intern - Application Report and Dashboard Support,IDS Medical Systems Group,Jakarta Raya,Full time,"Fresh graduate in IT, Computer Science, Data Analytics, or related field A",Tidak tersedia,Tidak tersedia,"Job Description: Support daily application operations, including user access management for reports and dashboards in the SBA Portal Assist with access updates and requests aligned with system changes Support development of key reports such as GL Transaction and Inventory Movement Help improve and automate manual reporting processes Collaborate with internal teams to deliver data-driven insights Qualifications: Fresh graduate in IT, Computer Science, Data Analytics, or related field Available for a 6-months internship period Basic understanding of databases and SQL Familiar with Business Intelligence tools (e.g., Power BI is a plus) Good English communication skills Plus Points: Experience in data analysis, reporting, or dashboard development; exposure to relational databases (e.g., MySQL); experience creating reports or visualizations","Support daily application operations, including user access management for reports and dashboards in the SBA Portal
Assist with access updates and requests aligned with system changes
Support development of key reports such as
GL Transaction
and
Inventory Movement
Help improve and automate manual reporting processes
Collaborate with internal teams to deliver data-driven insights",15 jam yang lalu,JobStreet
Data Engineer,"PT Delta Giri Wacana, Tbk.",Jakarta Utara,Full time,Tidak tersedia,Tidak tersedia,Tidak tersedia,"REQUIREMENT : Pendidikan min. S1 Memiliki pengalaman min. 2 tahun sebagai Data Engineer Menguasai SQL dan database Memahami ETL/ELT dan data warehouse Menguasai Python menjadi nilai tambah Memiliki komunikasi yang baik, proaktif, dan dinamis Mampu bekerjasama dalam tim maupun individu Bersedia ditempatkan di Sunter, Jakarta Utara JOB DESCRIPTION : Mengembangkan dan memelihara data pipeline. Mengelola proses ETL/ELT dari berbagai sumber data. Mengembangkan, memelihara, dan mengelola database serta sistem data perusahaan. Mengolah dan menyajikan data dalam format yang terstruktur dan mudah digunakan. Mengembangkan serta menerapkan metode dan algoritma analitik untuk meningkatkan kualitas sistem data dan efisiensi proses bisnis. Berkolaborasi dengan tim terkait untuk memastikan kebutuhan data dan bisnis terpenuhi secara optimal.",Tidak tersedia,16 jam yang lalu,JobStreet
ADMIN DATA ANALIS,PT Indonesia Multi Colour Printing (PT IMCP),Krian,Full time,Tidak tersedia,Tidak tersedia,Tidak tersedia,"Diploma/Bachelor Degree Statistic / Data Analyst Excellent to operate computer Have good analytical thinking Expert to arrange and create data presentation from original data stock Placement : Krian, Sidoarjo",Tidak tersedia,16 jam yang lalu,JobStreet
I2P Business Process Analyst,"PT SMART,Tbk",Jakarta Raya,Full time,1-2 years of working experience in Finance or Ac,Tidak tersedia,Tidak tersedia,"Job Description Summary : Responsible for supporting system and business process change implementation by serving as a liaison between the project team and end users. This role involves conducting user communication and training sessions, developing SOPs and Standard Working Instructions (SWI), and gathering user feedback to ensure successful implementation and continuous process improvement. Job Description : Act as a liaison between end users and the project team to support system change communication and adoption initiatives. Conduct user socialization sessions, gather feedback, and provide training to system users. Support the implementation of new SOPs and working procedures in accordance with established standards. Collect user feedback and support continuous improvement efforts following system implementation. Develop and maintain Standard Working Instructions (SWI). Job Requirement : Candidate must possess at least a Bachelor's Degree in Finance/Accounting Have at least 1-2 years of working experience in Finance or Accounting Understanding of end-to-end payment processes, including Invoice and Payment Processing Strong understanding of business processes and the ability to create systematic and detailed workflow documentation. Experience in reviewing and developing Standard Working Instructions (SWI) and/or Standard Operating Procedures (SOP). Proficient in SAP Finance modules, including SAP ECC and/or SAP S/4HANA. Advanced proficiency in Microsoft Excel, including basic to intermediate formulas and tools such as VLOOKUP/HLOOKUP, Pivot Tables, SUMIF, Power Query, and data analysis functions. Experience in ERP implementation or migration projects is preferred, particularly SAP S/4HANA migration, rollout, or transformation initiatives. "" Our company has never levied any fees for the recruitment process nor has it required to order tickets and accommodation through a certain travel agent or certain person""",Tidak tersedia,16 jam yang lalu,JobStreet
ADMIN DATABASE,PT. DINETA JAYAA,Denpasar Selatan,Full time,Tidak tersedia,Tidak tersedia,Rp 3.300.000 – Rp 3.800.000 per month,"Tugas & Tanggung Jawab: • Melakukan input, update, dan maintenance data perusahaan • Memastikan data yang diinput akurat dan sesuai standar perusahaan • Membuat laporan harian, mingguan, dan bulanan • Melakukan pengecekan serta validasi data • Mengolah dan menyajikan data sesuai kebutuhan manajemen • Mengarsipkan data dan dokumen secara sistematis • Berkoordinasi dengan departemen terkait untuk memastikan keakuratan data • Menjaga kerahasiaan data perusahaan",Tidak tersedia,17 jam yang lalu,JobStreet
Business Analyst,RemoHires,Jakarta Raya,Kontrak/Temporer,"0–3 years of experience in Business Analysis, Op",Tidak tersedia,Rp 7.000.000 – Rp 10.000.000 per month,"About the Role We are seeking a highly motivated and analytical Business Analyst to support business operations, process improvement initiatives, and product development efforts across the organization. This role will work closely with leadership, business stakeholders, and cross-functional teams to understand business needs, identify opportunities for improvement, and help drive strategic initiatives. The ideal candidate is naturally curious, communicates effectively, learns quickly, and has a strong interest in understanding how businesses operate. This position is well-suited for Business Administration graduates, MBA graduates, aspiring consultants, and early-career Business Analysts looking to develop broad exposure across business operations, strategy, and product development Key Responsibilities Analyze business processes, workflows, and operational performance to identify improvement opportunities. Collaborate with business stakeholders to gather, document, and clarify business requirements. Support product and software development initiatives by translating business needs into clear requirements and actionable recommendations. Work closely with cross-functional teams to ensure business objectives are aligned with project execution. Conduct business, market, and competitive research to support strategic decision-making. Develop reports, presentations, and business insights for leadership and stakeholders. Monitor key business metrics and assist in evaluating business performance. Identify operational bottlenecks and propose practical solutions to improve efficiency and effectiveness. Participate in process improvement and business transformation initiatives. Support special projects and strategic initiatives as assigned by leadership. Qualifications Bachelor's degree in Business Administration, Management, Economics, Finance, Engineering, Information Systems, or a related field. MBA graduates are encouraged to apply. 0–3 years of experience in Business Analy","This position is well-suited for Business Administration graduates, MBA graduates, aspiring consultants, and early-career Business Analysts looking to develop broad exposure across business operations, strategy, and product development Key Responsibilities",17 jam yang lalu,JobStreet
Data Center Staff,PT PROSPECT MOTOR,Cikarang Selatan,Full time,Fresh graduates are welcome and willing to learn,Tidak tersedia,Tidak tersedia,"Bachelor’s degree in Information Systems, Math, Statistics, Industrial Engineering, or related field (Min. GPA 3.01). Fresh graduates are welcome and willing to learn. Strong skills in Microsoft Office & Power BI. Intermediate English proficiency. Familiarity with Microsoft Dynamics 365 & SQL is a plus. Strong interest in the automotive industry. Placement: Cikarang",Tidak tersedia,17 jam yang lalu,JobStreet
Data Engineer,PT Platinumetrix Global Inovasi,Jakarta Selatan,Kontrak/Temporer,Tidak tersedia,Tidak tersedia,Rp 10.000.000 – Rp 15.000.000 per month,Berpengalaman menjadi data engineer ditempatkan di banking di jakarta,Tidak tersedia,18 jam yang lalu,JobStreet
Lead Quality Engineer,Macquarie Group,Indonesia,Full time,Tidak tersedia,Tidak tersedia,Tidak tersedia,"Additional office locations Sydney Job ID 22333 Date 12-Jun-2026 Permanent - Full time, Senior Job category BFS - Quality Engineer What role will you play: In this role you will help redefine quality engineering by using artificial intelligence as a core part of your daily work. You will build and improve automated testing practices, frameworks and controls that support faster, high-quality delivery. You will also help shape our approach to quality as technology evolves, ensuring the team can confidently deliver across multiple systems. What role will you play: In this role you will help redefine quality engineering by using artificial intelligence as a core part of your daily work. You will build and improve automated testing practices, frameworks and controls that support faster, high-quality delivery. You will also help shape our approach to quality as technology evolves, ensuring the team can confidently deliver across multiple systems.",Tidak tersedia,18 jam yang lalu,JobStreet
Business Manager - Wrap Platform,Macquarie Group,Indonesia,Full time,Tidak tersedia,Tidak tersedia,Tidak tersedia,"Additional office locations Sydney Job ID 22512 Date 12-Jun-2026 Permanent - Full time, Mid-senior Job category BFS - Business Manager Prior experience in a strategy or operations role, within the financial services sector Strong analytical capability, with experience working with financial and operational data to track performance, identify trends, and draw commercial insights; proficiency in Excel is essential and ThoughtSpot is highly valued Advanced capability in presentation and data analysis tools, with a commercially focused approach, linking platform and operational initiatives to tangible business outcomes. Excellent communication skills that allow you to translate complex data and analysis into clear, compelling narratives for a range of stakeholders Strong planning and prioritisation skills, with the ability to manage competing demands and maintain momentum across a diverse workload Confidence using AI tools, supported by a continuous learning mindset. Prior experience in a strategy or operations role, within the financial services sector Strong analytical capability, with experience working with financial and operational data to track performance, identify trends, and draw commercial insights; proficiency in Excel is essential and ThoughtSpot is highly valued Advanced capability in presentation and data analysis tools, with a commercially focused approach, linking platform and operational initiatives to tangible business outcomes. Excellent communication skills that allow you to translate complex data and analysis into clear, compelling narratives for a range of stakeholders Strong planning and prioritisation skills, with the ability to manage competing demands and maintain momentum across a diverse workload Confidence using AI tools, supported by a continuous learning mindset.",Tidak tersedia,18 jam yang lalu,JobStreet
Data Management Product Owner Manager,Macquarie Group,Indonesia,Full time,Tidak tersedia,Tidak tersedia,Tidak tersedia,"Additional office locations Sydney Job ID 22667 Date 12-Jun-2026 Permanent - Full time, Mid-level Job category Other, Technology - Data Steward / Governance, Technology - Product As a Product Manager, you will support the design, development and enhancement of data management products and tools, with a focus on improving data governance and quality to ensure it is fit for use and AI ready. You will work closely with the Associate Director and broader team to help deliver against the product roadmap, gather stakeholder requirements and assist in translating these into practical solutions. You will contribute to the ongoing improvement of products, support delivery activities and collaborate with business and technology teams to achieve positive outcomes. As a Product Manager, you will support the design, development and enhancement of data management products and tools, with a focus on improving data governance and quality to ensure it is fit for use and AI ready. You will work closely with the Associate Director and broader team to help deliver against the product roadmap, gather stakeholder requirements and assist in translating these into practical solutions. You will contribute to the ongoing improvement of products, support delivery activities and collaborate with business and technology teams to achieve positive outcomes.",Tidak tersedia,18 jam yang lalu,JobStreet
Data Analys Marketplace,PT. BOSMAN GROUP INDONESIA,Depok,Full time,Tidak tersedia,Tidak tersedia,Rp 3.000.000 – Rp 4.000.000 per month,"Minimal pendidikan D3/S1
Mampu mengoperasikan laptop dan aplikasi berbasis sistem (Excel / Google Sheets diutamakan).
Teliti, detail, dan terbiasa bekerja dengan data.
Memiliki kemampuan analisa dasar terkait penjualan (nilai tambah).
Bertanggung jawab dan mampu bekerja secara mandiri.
Bersedia bekerja sesuai shift yang ditentukan.
Wajib memiliki laptop pribadi.","Menarik (export) data penjualan harian, mingguan, dan bulanan dari sistem aplikasi (Shopee, Grab, Gojek)
Melakukan review dan analisa sederhana terhadap margin penjualan.
Menginput dan memperbarui data menu (harga, deskripsi, ketersediaan, dll) di aplikasi.
Memastikan data yang diinput akurat dan sesuai dengan kondisi operasional.
Melakukan monitoring terhadap performa penjualan melalui sistem.
Melakukan promosi menu baru, promo, dll di marketplace
Membuat laporan sederhana terkait penjualan dan margin secara berkala.",21 jam yang lalu,JobStreet
Artificial Intelligence (AI) Specialist Intern,CV. Cipta Duta Teknologi,Malang,Full time,fresh graduate,Tidak tersedia,Rp 500.000 – Rp 700.000 per month,"Artificial Intelligence (AI) Specialist Intern (unpaid) Kualifikasi: - Mahasiswa aktif atau fresh graduate. - Memiliki minat kuat pada Artificial Intelligence. - Terbiasa menggunakan ChatGPT, Gemini, Claude, atau tools AI lainnya. - Mampu berpikir logis, analitis, dan memiliki kemampuan belajar yang tinggi. - Memahami dasar API, automasi, atau pemrograman menjadi nilai tambah. - Bersedia magang on-site selama 6 bulan. Job Description: - Membuat dan mengoptimalkan prompt AI untuk kebutuhan bisnis. - Mengembangkan dan menguji AI Agent. - Membuat workflow automasi menggunakan platform AI dan no-code tools. - Melakukan riset teknologi AI terbaru. - Membantu integrasi AI dengan aplikasi dan sistem perusahaan. - Membuat dokumentasi dan SOP penggunaan AI. Benefit: - Makan siang & snack. - Sertifikat Magang & Portofolio kerja nyata. - Pengalaman mengerjakan proyek AI nyata. - Akses diskusi, mentoring, dan pembelajaran langsung dari Senior Developer serta AI Engineer. - Lingkungan kerja yang mendukung pengembangan skill AI dan teknologi modern.",Tidak tersedia,21 jam yang lalu,JobStreet
Business Analyst Staff,PT. Fidac Inovasi Technology,Jakarta Selatan,Full time,"minimal 1 tahun di bidang administrasi, reporting, busi",Tidak tersedia,Tidak tersedia,"Pendidikan minimal S1 dari jurusan Sistem Informasi, Teknik Informatika, Manajemen, Statistika, Matematika, Ekonomi, atau jurusan terkait.
Memiliki pengalaman minimal 1 tahun di bidang administrasi, reporting, business support, business analyst, atau posisi sejenis.
Terbiasa melakukan pengolahan data dan penyusunan laporan.
Mampu mengolah data menggunakan Microsoft Excel atau Google Sheets (Pivot Table, Lookup, dan Formula lainnya).
Memiliki kemampuan analisis yang baik serta teliti terhadap detail.
Memiliki kemampuan komunikasi, koordinasi, dan dokumentasi yang baik.
Mampu bekerja secara detail, terorganisir, dan memenuhi target yang ditentukan.
Memiliki pengalaman di industri fintech, perbankan, multifinance, atau perusahaan teknologi menjadi nilai tambah.",Tidak tersedia,21 jam yang lalu,JobStreet
IT System Analyst - Data,PT ABISHAR TECHNOLOGIES INDONESIA,Jakarta Selatan,Kontrak/Temporer,Tidak tersedia,Tidak tersedia,Tidak tersedia,"Requirements: Bachelor’s degree in Information Technology, Computer Science, or related field Minimum 4 years of experience as a System Analyst in Data Hands-on experience in data-based projects (example: data migration) Experience in creating ERD Strong database skills, including: MS SQL, DB2, Datalake (advantage), Snowflake (advantage) Job Responsibilities: Analyze and gather system requirements for data-related projects Create and maintain ERD / database schema design Develop functional specifications and technical documentation Collaborate with developers, QA, and stakeholders Support data integration and migration processes",Tidak tersedia,21 jam yang lalu,JobStreet
System Analyst (Data Related Projects),PT ABISHAR TECHNOLOGIES INDONESIA,Jakarta Raya,Kontrak/Temporer,"3-4 years of experience as a System Analyst, Bus",Tidak tersedia,Tidak tersedia,"Job Responsibilities Gather, analyze, and document business and system requirements from stakeholders. Create Functional Specification Documents (FSD), business process flows, and system documentation. Analyze existing systems, databases, and business processes to support implementation and data migration projects. Develop and maintain Entity Relationship Diagrams (ERD) , data flow diagrams, and system workflows. Collaborate with developers, QA, project managers, and business users throughout the project lifecycle. Define data mapping requirements and support data migration, validation, and reconciliation activities. Participate in system testing, user acceptance testing (UAT), and post-implementation support. Ensure solutions align with business requirements and technical specifications. Requirements Bachelor's Degree in Information Technology, Information Systems, Computer Science, or related fields. Minimum 3-4 years of experience as a System Analyst, Business Analyst, or similar role. Strong understanding of Entity Relationship Diagrams (ERD) and database design concepts (Mandatory). Experience in system implementation, enhancement, or data migration projects . Strong SQL skills for data analysis and validation. Experience creating requirement documents, functional specifications, workflow diagrams, and use cases. Familiar with SDLC, Agile, or Waterfall methodologies. Strong analytical, problem-solving, and communication skills. Able to communicate effectively with both technical and non-technical stakeholders. Preferred Qualifications Experience in data mapping, data validation, and data reconciliation. Familiarity with Microsoft SQL Server, MySQL, PostgreSQL, or Oracle Database. Experience in ERP, healthcare systems, banking systems, insurance systems, or enterprise application projects. Knowledge of API integration and system integration concepts is a plus.",Tidak tersedia,22 jam yang lalu,JobStreet
